<?xml version="1.0" encoding="utf-8"?>
<root 
	xmlns:xsi="http://www.w3.org/2001/XMLSchema-instance" 
	xsi:noNamespaceSchemaLocation="demo-3.xsd">
	
	<customers>
		<customer>
			<id>A-1</id>
			<name>Вася</name>
			<addr>Адрес</addr>
		</customer>
		<customer>
			<id>A-2</id>
			<name>Петя</name>
			<addr>Адрес</addr>
		</customer>	
	</customers>
	
	<clerks>
		<clerk>
			<id>B-1</id>
			<name>Саша</name>
			<office>Адрес</office>
		</clerk>
		<clerk>
			<id>B-2</id>
			<name>Сережа</name>
			<office>Адрес</office>
		</clerk>	
	</clerks>
	

	

</root>